map_id,system_id,system_name,linked_req,nv_contribution,design_spec_note,concern
VSM01,SYS01,タイヤ（低転がり仕様）,R01/R02/R03,ロードノイズ・こもり音の源流,低転がり抵抗タイヤに変更（銘柄変更あり）,転がり抵抗低減とNVのトレードオフが懸念
VSM02,SYS02,リアサスペンションブッシュ,R01/R02/R03/R04,入力伝達経路（フィルタ特性）,ブッシュ剛性を操安目的で変更（高剛性化）,高剛性化によりNVへの入力増加が懸念
VSM03,SYS03,サブフレーム締結,R03,振動伝達経路,締結トルク変更（トルクアップ）,マウント効果の低下による伝達増加が懸念
VSM04,SYS04,ボディ（フロア/リア），R01/R02/R03,車室内応答・パネル振動,変更なし（ただし軽量化でパネル板厚変更の可能性を確認中）,板厚変更があれば共振周波数変化の可能性
VSM05,SYS05,フロア遮音吸音材,R01/R02/R03,空気伝搬・構造伝搬低減,軽量化目的で100g/m2削減,遮音材削減による伝搬増加が懸念
VSM06,SYS06,ドアシール/ピラー,R05,風切り音の源流と遮断,変更なし,風切り音はロードノイズ改善後に相対的に浮かないか確認要
VSM07,SYS07,電動パワートレーン（モーター/ギヤ），R06/R07,電磁音・機械音の源流,変更なし（新型モーター採用）,新型モーター固有の音質・次数特性を確認要
VSM08,SYS08,ANC（能動騒音制御），R01/R03,能動的な低周波音低減,搭載予定（詳細TBD）,制御帯域・違和感回避の調整が必要
